{
  "schemaVersion": "1.0",
  "date": "2026-09-12",
  "timezone": "Asia/Shanghai",
  "generatedAt": "2026-09-12T09:30:12Z",
  "stats": {
    "sourceTotal": 14,
    "sourceOk": 12,
    "sourceFailed": 2,
    "itemsBeforeDedup": 268,
    "itemsAfterDedup": 251,
    "mergedCount": 17,
    "durationMs": 8421
  },
  "items": [
    {
      "id": "it_9f2c1a7b3e5d",
      "guid": "https://www.ruanyifeng.com/blog/2026/09/weekly-324.html",
      "title": "科技爱好者周刊（第 324 期）：AI 编程助手的一年",
      "url": "https://www.ruanyifeng.com/blog/2026/09/weekly-324.html?utm_source=rss&utm_medium=rss",
      "summary": "本期主题是 AI 编程助手落地一年后的真实体验：哪些环节真被加速，哪些反而是负担。同时收录本周值得读的开源项目与技术文章。",
      "author": "阮一峰",
      "channelId": "ruanyifeng-blog",
      "channelName": "阮一峰的网络日志",
      "category": ["tech_blog"],
      "publishedAt": "2026-09-12T00:05:00Z",
      "updatedAt": "2026-09-12T01:20:00Z",
      "fetchedAt": "2026-09-12T09:30:05Z",
      "sourceUrl": "https://www.ruanyifeng.com/blog/weekly/rss.xml",
      "sourceType": "rss",
      "tags": ["AI", "编程助手", "周刊"],
      "dedupKey": "8f0c1d2e3a4b5c6d7e8f9a0b1c2d3e4f5a6b7c8d9e0f1a2b3c4d5e6f7a8b9c0d",
      "duplicateOf": null,
      "sourceCount": 2,
      "sources": [
        { "channelId": "ruanyifeng-blog", "channelName": "阮一峰的网络日志", "url": "https://www.ruanyifeng.com/blog/2026/09/weekly-324.html?utm_source=rss&utm_medium=rss", "publishedAt": "2026-09-12T00:05:00Z" },
        { "channelId": "v2ex", "channelName": "V2EX", "url": "https://www.v2ex.com/t/9000001", "publishedAt": "2026-09-12T01:10:00Z" }
      ],
      "isNew": true,
      "hotScore": 0.87,
      "language": "zh-CN",
      "mediaType": "article"
    },
    {
      "id": "it_4a2b8c0d6e1f",
      "guid": "tag:huggingface.co,2026:blog/smol-course",
      "title": "Smol Course: training small language models from scratch",
      "url": "https://huggingface.co/blog/smol-course",
      "summary": "A hands-on course on training small language models. Covers data curation, tokenizer training, and efficient fine-tuning on consumer GPUs.",
      "author": "Hugging Face",
      "channelId": "huggingface-blog",
      "channelName": "Hugging Face Blog",
      "category": ["ai", "opensource"],
      "publishedAt": "2026-09-11T15:40:00Z",
      "updatedAt": "2026-09-12T02:00:00Z",
      "fetchedAt": "2026-09-12T09:30:12Z",
      "sourceUrl": "https://huggingface.co/blog/feed.xml",
      "sourceType": "rss",
      "tags": ["LLM", "training", "course"],
      "dedupKey": "7e1f0a9b8c7d6e5f4a3b2c1d0e9f8a7b6c5d4e3f2a1b0c9d8e7f6a5b4c3d2e1f",
      "duplicateOf": null,
      "sourceCount": 1,
      "sources": [
        { "channelId": "huggingface-blog", "channelName": "Hugging Face Blog", "url": "https://huggingface.co/blog/smol-course", "publishedAt": "2026-09-11T15:40:00Z" }
      ],
      "isNew": true,
      "hotScore": 0.79,
      "language": "en",
      "mediaType": "article"
    },
    {
      "id": "it_1c3d5e7f9a0b",
      "guid": "https://news.ycombinator.com/item?id=42000001",
      "title": "Show HN: A static RSS aggregator with zero backend",
      "url": "https://news.ycombinator.com/item?id=42000001",
      "urlStatus": "ok",
      "urlCheckedAt": "2026-09-12T10:00:02Z",
      "summary": "I built a static-site RSS aggregator that runs entirely on GitHub Actions and Pages. Feedback welcome on the dedup approach.",
      "author": "hn_user42",
      "channelId": "hacker-news",
      "channelName": "Hacker News",
      "category": ["dev_community"],
      "publishedAt": "2026-09-12T03:15:00Z",
      "updatedAt": "2026-09-12T05:02:00Z",
      "fetchedAt": "2026-09-12T09:30:11Z",
      "sourceUrl": "https://news.ycombinator.com/rss",
      "sourceType": "rss",
      "tags": ["static-site", "RSS", "show-hn"],
      "dedupKey": "2b3c4d5e6f7a8b9c0d1e2f3a4b5c6d7e8f9a0b1c2d3e4f5a6b7c8d9e0f1a2b3c",
      "duplicateOf": null,
      "sourceCount": 1,
      "sources": [
        { "channelId": "hacker-news", "channelName": "Hacker News", "url": "https://news.ycombinator.com/item?id=42000001", "publishedAt": "2026-09-12T03:15:00Z" }
      ],
      "isNew": true,
      "hotScore": 0.72,
      "language": "en",
      "mediaType": "post"
    },
    {
      "id": "it_0d9e8f7a6b5c",
      "guid": "https://www.v2ex.com/t/9000001",
      "title": "科技爱好者周刊（第 324 期）：AI 编程助手的一年",
      "url": "https://www.v2ex.com/t/9000001",
      "summary": "转载阮一峰周刊第 324 期，讨论区补充了不少一线开发者的实测经验。",
      "author": "v2ex_user",
      "channelId": "v2ex",
      "channelName": "V2EX",
      "category": ["dev_community"],
      "publishedAt": "2026-09-12T01:10:00Z",
      "updatedAt": "2026-09-12T01:10:00Z",
      "fetchedAt": "2026-09-12T09:30:08Z",
      "sourceUrl": "https://www.v2ex.com/feed/tab/hot.xml",
      "sourceType": "rss",
      "tags": ["周刊", "AI"],
      "dedupKey": "8f0c1d2e3a4b5c6d7e8f9a0b1c2d3e4f5a6b7c8d9e0f1a2b3c4d5e6f7a8b9c0d",
      "duplicateOf": "it_9f2c1a7b3e5d",
      "sourceCount": 1,
      "sources": [
        { "channelId": "v2ex", "channelName": "V2EX", "url": "https://www.v2ex.com/t/9000001", "publishedAt": "2026-09-12T01:10:00Z" }
      ],
      "isNew": true,
      "hotScore": null,
      "language": "zh-CN",
      "mediaType": "post"
    },
    {
      "id": "it_3e2d1c0b9a8f",
      "guid": "https://techcrunch.com/?p=2900001",
      "title": "OpenAI unveils cheaper inference tier for developers",
      "url": "https://techcrunch.com/2026/09/12/openai-cheaper-inference-tier/",
      "urlStatus": "ok",
      "urlCheckedAt": "2026-09-12T10:00:04Z",
      "summary": "The new pricing tier targets high-volume workloads, cutting per-token cost for batch inference. Availability starts next week.",
      "author": "Jane Reporter",
      "channelId": "techcrunch",
      "channelName": "TechCrunch",
      "category": ["tech_media", "news"],
      "publishedAt": "2026-09-12T06:45:00Z",
      "updatedAt": "2026-09-12T07:10:00Z",
      "fetchedAt": "2026-09-12T09:30:13Z",
      "sourceUrl": "https://techcrunch.com/feed/",
      "sourceType": "rss",
      "tags": ["OpenAI", "pricing", "inference"],
      "dedupKey": "5a6b7c8d9e0f1a2b3c4d5e6f7a8b9c0d1e2f3a4b5c6d7e8f9a0b1c2d3e4f5a6b",
      "duplicateOf": null,
      "sourceCount": 1,
      "sources": [
        { "channelId": "techcrunch", "channelName": "TechCrunch", "url": "https://techcrunch.com/2026/09/12/openai-cheaper-inference-tier/", "publishedAt": "2026-09-12T06:45:00Z" }
      ],
      "isNew": true,
      "hotScore": 0.68,
      "language": "en",
      "mediaType": "article"
    }
  ]
}
